id,object,task_id,annonce_id,agency_id,agency_page,agency_contact_name,agency_img_url,agency_phone_number,agency_has_email,agency_link,address,area,bedrooms_count,business_unit,coownership_annual_charges,coownership_number_of_lots,coownership_is_syndic_procedure,contact_is_private_seller,contact_email,description,district,dpe,estate_type,electricity_consumption,estate_type_id,ges,gas_emissions,highlighting_level,insee_code,is_furnished,is_exclusive,is_expired,monthly_price,nature,postal_code,picture_count,price,price_per_meter,price_decrease_percent,publication_id,rooms,short_description,transaction_type,tags,url,virtual_visit_url,collected_at,input_url,sold,selling_time,old_price
5830282,result,41,221348147,105026,https://www.seloger.com/professionnels/agences-immobilieres/st-jean-de-luz-64500/agence-75461/,aRtIS IMMObILIER,https://v.seloger.com/s/width/150/logos/2/8/w/l/28wlhxeoneu2704u31ur03fc97f9dno3whs9o5tu7.jpg,05 59 26 46 82,t,http://www.artis-immo.fr/,Hendaye,76.00116924875768,0,1,,,,f,t,,Gare-Joncaux,F,appartement,,1,D,,1,,f,f,f,1452,1,64700,3,210000,3421,,30105026,4,"appartement à vendre - plein centre Hendaye Idealement situe, au dernier etage d'une charmante residence, ce t4 est proche de toutes les commodites. tres lumineux avec son orientation sud, il offre de beaux volumes avec ses 76m2. Son box est un atout indispensable ! prevoir un rafraichissement. Contactez-nous pour les visites.",2,"4 pieces, 3 chambres, 76 m2, balcon, box",https://www.seloger.com/annonces/achat/appartement/hendaye-64/Gare-Joncaux/221348147.htm,,2024-06-29 14:06:42.356026,"https://www.seloger.com/list.htm?projects=2,5&types=1&natures=1,2,4&places=[{%22inseeCodes%22:[640260]}]&price=NaN/300000&enterprise=0&qsVersion=1.0&sort=d_dt_crea&m=search_hp_last",n,,260000
5519355,result,47,218993377,359178,https://www.seloger.com/professionnels/agences-immobilieres/hendaye-64700/agence-64378/,IpaRRaLDE IMMObILIER,https://v.seloger.com/s/width/150/logos/0/6/s/u/06suslue294ym3v3tm677wsf77ft8cngd4ewu6pab.jpg,05 47 75 94 67,t,,Hendaye,72.13520197856553,0,1,,,,f,t,,Orio,C,appartement,,1,D,,1,,f,f,f,1466,1,64700,30,262500,3639,,30359178,3,"appartement à vendre - bienvenue dans cet appartement t3 de 72,13m2, idealement agence pour offrir confort et fonctionnalite à ses residents. Cette propriete ravira les amateurs de tranquillite et de confort moderne. En franchissant la porte d'entree, vous serez immediatement seduit par l'espace et la luminosite qui se degagent du grand sejour. [...]",2,"3 pieces, 2 chambres, 72 m2, etage 1/3, terrasse, parking",https://www.seloger.com/annonces/achat/appartement/hendaye-64/218993377.htm,,2024-06-29 14:06:45.131523,"https://www.seloger.com/list.htm?projects=2,5&types=1&natures=1,2,4&places=[{%22inseeCodes%22:[640260]}]&price=NaN/300000&enterprise=0&qsVersion=1.0&sort=d_dt_crea&m=search_hp_last",n,,
5830253,result,6,223140929,465386,https://www.seloger.com/professionnels/agences-immobilieres/hendaye-64700/agence-97287/,GUY HOQUEt HENDaYE,https://v.seloger.com/s/width/150/logos/0/e/3/q/0e3q8x48ny3apy7og2cn1zlldo8tx3lwvhv62nibc.jpg,05 59 59 98 77,t,,Hendaye,40,0,1,,,,f,t,,Centre Ville-La plage,F,appartement,,1,F,,1,,f,t,f,1485,1,64700,6,266000,6650,,30465386,2,"appartement à vendre - Coeur de plage, tres agreable t2 de 40m2 environ, disposant d'une terrasse et d'une cave privative. appartement en parfait etat. Ideal pour un mode de vie tout à pied. Coup de coeur assure! Copropriete de 100 lots (pas de procedure en cours).  Charges annuelles : 960.00 euros. argitxu CELaYa (EI) agent Commercial - Numero [...]",2,"2 pieces, 1 chambre, 40 m2, etage –/4, terrasse, ascenseur",https://www.seloger.com/annonces/achat/appartement/hendaye-64/centre-ville-la-plage/223140929.htm,,2024-06-29 14:06:10.791299,"https://www.seloger.com/list.htm?projects=2,5&types=1&natures=1,2,4&places=[{%22inseeCodes%22:[640260]}]&price=NaN/300000&enterprise=0&qsVersion=1.0&sort=d_dt_crea&m=search_hp_last",n,,
5830256,result,9,222889165,75897,https://www.seloger.com/professionnels/agences-immobilieres/hendaye-64700/agence-129963/,batIMO aGENCE LaGUILLON,https://v.seloger.com/s/width/150/logos/1/b/c/t/1bctbb3tho67n51exo9090awsfvhoxg1o3t5gtr40.jpg,05 59 48 00 78,t,http://www.agence-laguillon.com/,Hendaye,43.99934329338368,0,1,,,,f,t,,Moleres-Sopite,E,appartement,,1,B,,1,,f,t,f,1496,1,64700,12,268000,6091,,30075897,3,"appartement à vendre - Dans une residence securisee avec piscine, espaces verts et fronton, charmant 3 pieces comprenant : sejour ouvrant sur terrasse de 25 m2, cuisine ouverte equipee, 2 chambres avec placards, salle d'eau avec WC. Cellier exterieur. Une place de parking complete ce bien rare.",2,"3 pieces, 2 chambres, 44 m2, etage 0/0, terrasse, parking, piscine",https://www.seloger.com/annonces/achat/appartement/hendaye-64/222889165.htm,,2024-06-29 14:06:12.256287,"https://www.seloger.com/list.htm?projects=2,5&types=1&natures=1,2,4&places=[{%22inseeCodes%22:[640260]}]&price=NaN/300000&enterprise=0&qsVersion=1.0&sort=d_dt_crea&m=search_hp_last",n,,
5830251,result,4,223168809,531006,https://www.seloger.com/professionnels/agences-immobilieres/hendaye-64700/agence-131251/,O.G.I. - a. pEREZ IMMObILIER,,06 62 82 86 81,t,,Hendaye,41.997200186654226,0,1,,,,f,t,,Gare-Joncaux,C,appartement,,1,A,,1,,f,f,f,1508,1,64700,6,270000,6429,,30531006,2,appartement à vendre - Hendaye appartement dans une residence recente en excellent etat. Le logement est situe au troisieme et dernier etage avec ascenseur Il offre une piece de vie et une terrasse exposee sud-est un parking exterieur ainsi qu'un box boxe interieur. a visiter des que possible!,2,"2 pieces, 1 chambre, 42 m2, etage 0/–, box, ascenseur",https://www.seloger.com/annonces/achat/appartement/hendaye-64/223168809.htm,,2024-06-29 14:06:09.865154,"https://www.seloger.com/list.htm?projects=2,5&types=1&natures=1,2,4&places=[{%22inseeCodes%22:[640260]}]&price=NaN/300000&enterprise=0&qsVersion=1.0&sort=d_dt_crea&m=search_hp_last",n,,
5830254,result,7,223138443,385198,https://www.seloger.com/professionnels/agences-immobilieres/hendaye-64700/agence-10941/,LOIa IMMObILIER,,05 59 08 71 23,t,,Hendaye,41.997200186654226,0,1,,,,f,t,,Moleres-Sopite,C,appartement,,1,A,,1,,f,f,f,1508,1,64700,8,270000,6429,,982997,2,"appartement à vendre - appartement en tres bon etat dans une residence recente. Ce bien se situe au dernier etage avec ascenseur, et dispose d'un parking exterieur et d'un box interieur. terrasse exposee SUD-ESt. a visiter sans tarder !",2,"2 pieces, 1 chambre, 42 m2, etage 3/0, terrasse, box, parking, ascenseur",https://www.seloger.com/annonces/achat/appartement/hendaye-64/223138443.htm,,2024-06-29 14:06:11.293768,"https://www.seloger.com/list.htm?projects=2,5&types=1&natures=1,2,4&places=[{%22inseeCodes%22:[640260]}]&price=NaN/300000&enterprise=0&qsVersion=1.0&sort=d_dt_crea&m=search_hp_last",y,1 month,
3946405,result,49,206728311,75897,https://www.seloger.com/professionnels/agences-immobilieres/hendaye-64700/agence-129963/,batIMO aGENCE LaGUILLON,https://v.seloger.com/s/width/150/logos/1/b/c/t/1bctbb3tho67n51exo9090awsfvhoxg1o3t5gtr40.jpg,05 59 48 00 78,t,http://www.agence-laguillon.com/,Hendaye,52.99672383888996,0,1,,,,f,t,,Centre Ville-La plage,C,appartement,,1,C,,1,,f,t,f,1535,1,64700,24,275000,5189,,30075897,3,"appartement à vendre - au coeur du centre ville d'Hendaye, au deuxieme etage, appartement de type 3 pieces joliment renove comprenant un sejour-cuisine equipee ouvrant sur un balcon expose sud, 2 belles chambres, salle d'eau moderne, wc. Une cave complete ce bien ideal pour une vie avec les commerces à pied.",2,"3 pieces, 2 chambres, 53 m2, etage 2/3, balcon",https://www.seloger.com/annonces/achat/appartement/hendaye-64/206728311.htm,,2024-06-29 14:06:46.112741,"https://www.seloger.com/list.htm?projects=2,5&types=1&natures=1,2,4&places=[{%22inseeCodes%22:[640260]}]&price=NaN/300000&enterprise=0&qsVersion=1.0&sort=d_dt_crea&m=search_hp_last",n,,
5830274,result,31,221727263,531006,https://www.seloger.com/professionnels/agences-immobilieres/hendaye-64700/agence-131251/,O.G.I. - a. pEREZ IMMObILIER,,06 62 82 86 81,t,,Hendaye,43.99744572158365,0,1,,,,f,t,,Centre Ville-La plage,E,appartement,,1,B,,1,,f,t,f,1539,1,64700,10,275600,6264,,30531006,2,"appartement à vendre - Hendaye, appartement du type t2 d'environ 43m 2 Venez decouvrir cet appartement du centre plage il se compose : Une entree, une cuisine, d'un beau salon d'environ 18 m2, d'une salle de bain, d'une toilette separee, d'une chambre spacieuse appartement tres lumineuse exposee plein sud. pour complete ce bien vous disposerait [...]",2,"2 pieces, 1 chambre, 44 m2, etage 4/6, balcon, parking, ascenseur",https://www.seloger.com/annonces/achat/appartement/hendaye-64/centre-ville-la-plage/221727263.htm,,2024-06-29 14:06:37.444033,"https://www.seloger.com/list.htm?projects=2,5&types=1&natures=1,2,4&places=[{%22inseeCodes%22:[640260]}]&price=NaN/300000&enterprise=0&qsVersion=1.0&sort=d_dt_crea&m=search_hp_last",n,,
5928272,result,49195394,224493893,476929,https://www.seloger.com/professionnels/agences-immobilieres/hendaye-64700/agence-129167/,SQUARE HABITAT HENDAYE,,05 59 51 05 10,t,,Hendaye,27.001171417415073,0,1,,,,f,t,,Centre Ville-La Plage,D,studio,,1,B,,1,,f,f,f,1544,1,64700,16,276600,10244,,30476929,1,"appartement à vendre - Ne tardez pas à venir visiter cet agréable studio situé face a la mer, au deuxième etage d'une charmante copropriété à taille humaine. Il dispose d'une piece de vie donnant sur une loggia ,une place de parking extérieure complète ce bien. Idéal pour un mode de vie tout à pied.",2,"1 piece, 27 m2, etage 2/4",https://www.seloger.com/annonces/achat/appartement/hendaye-64/centre-ville-la-plage/224493893.htm,,2024-07-23 10:22:49.723891,"https://www.seloger.com/list.htm?projects=2,5&types=1&natures=1,2,4&places=[{%22inseeCodes%22:[640260]}]&price=NaN/300000&enterprise=0&qsVersion=1.0&sort=d_dt_crea&m=search_hp_last",y,1 week,
5830302,result,67,218218951,235420,https://www.seloger.com/professionnels/agences-immobilieres/paris-18eme-arrondissement-75018/agence-71211/,un particulier,,,t,,Hendaye,42.00151630022744,0,1,,,,t,t,,Centre Ville-La plage,G,appartement,,1,G,,1,,f,f,f,1546,1,64700,8,285000,6595,,1051452,2,"Vente entre particuliers appartement - appartement unique à vendre dans un immeuble situe sur le front de mer dans un quartier calme et anime en ete dans un immeuble avec ascenseur (deux ascenseurs). L’appartement dispose d’une chambre, salon, une salle de bains , toilette, et une cuisine entierement equipee en plus d’une salle de stockage ou [...]",2,"2 pieces, 1 chambre, 42 m2, etage 4/4, balcon, ascenseur",https://www.seloger.com/annonces/achat/appartement/hendaye-64/centre-ville-la-plage/218218951.htm,,2024-06-29 14:07:09.489142,"https://www.seloger.com/list.htm?projects=2,5&types=1&natures=1,2,4&places=[{%22inseeCodes%22:[640260]}]&price=NaN/300000&enterprise=0&qsVersion=1.0&sort=d_dt_crea&m=search_hp_last",n,,277000
5830264,result,18,222201267,531006,https://www.seloger.com/professionnels/agences-immobilieres/hendaye-64700/agence-131251/,O.G.I. - a. pEREZ IMMObILIER,,06 62 82 86 81,t,,Hendaye,71.99792960662526,0,1,,,,f,t,,Centre Ville-La plage,D,appartement,,1,E,,1,,f,f,f,1553,1,64700,8,278200,3864,,30531006,3,"appartement à vendre - Decouvrez cet appartement de grande surface, situe à proximite du centre-ville. Il comprend une cuisine independante, un salon, deux grandes chambres, une salle de bain et un toilette independante. Il se trouve au deuxieme et dernier etage et domine la mer, la baie et Fontarrabie. L'appartement dispose d'un parking [...]",2,"3 pieces, 2 chambres, 72 m2, etage 2/2, balcon, parking",https://www.seloger.com/annonces/achat/appartement/hendaye-64/222201267.htm,,2024-06-29 14:06:16.791436,"https://www.seloger.com/list.htm?projects=2,5&types=1&natures=1,2,4&places=[{%22inseeCodes%22:[640260]}]&price=NaN/300000&enterprise=0&qsVersion=1.0&sort=d_dt_crea&m=search_hp_last",n,,
5830265,result,19,222201261,531006,https://www.seloger.com/professionnels/agences-immobilieres/hendaye-64700/agence-131251/,O.G.I. - a. pEREZ IMMObILIER,,06 62 82 86 81,t,,Hendaye,71.99792960662526,0,1,,,,f,t,,Centre Ville-La plage,D,appartement,,1,E,,1,,f,f,f,1553,1,64700,9,278200,3864,,30531006,3,"appartement à vendre - Cet appartement de 72 m2 dispose d'une cuisine separee, d'un salon, de deux belles chambres avec un balcon, d'une salle d'eau et d'un toilette separes. De plus, l'appartement beneficie d'un parking exterieur et d'une cave. Il se trouve au premier etage et a une excellente vue sur la baie de txingudy et sur la mer. petite [...]",2,"3 pieces, 2 chambres, 72 m2, etage 1/2, balcon, parking",https://www.seloger.com/annonces/achat/appartement/hendaye-64/centre-ville-la-plage/222201261.htm,,2024-06-29 14:06:17.276628,"https://www.seloger.com/list.htm?projects=2,5&types=1&natures=1,2,4&places=[{%22inseeCodes%22:[640260]}]&price=NaN/300000&enterprise=0&qsVersion=1.0&sort=d_dt_crea&m=search_hp_last",n,,
5830311,result,88,214142677,385198,https://www.seloger.com/professionnels/agences-immobilieres/hendaye-64700/agence-10941/,LOIa IMMObILIER,,05 59 08 71 23,t,,Hendaye,71.99792960662526,0,1,,,,f,t,,Centre Ville-La plage,D,appartement,,1,E,,1,,f,f,f,1553,1,64700,9,278200,3864,,982997,3,"appartement à vendre - bel appartement de 72m2 beneficiant d'une cuisine separee, d'un salon, de deux belles chambres avec un balcon, d'une salle d'eau et d'un WC separe. De plus cet appartement dispose d'une place de parking exterieure, et d'une cave. Situe au premier etage, il offre une tres belle vue sur la baie de txingudy et la mer. [...]",2,"3 pieces, 2 chambres, 72 m2, etage 1/2, 2 balcon, parking",https://www.seloger.com/annonces/achat/appartement/hendaye-64/214142677.htm,,2024-06-29 14:07:32.288359,"https://www.seloger.com/list.htm?projects=2,5&types=1&natures=1,2,4&places=[{%22inseeCodes%22:[640260]}]&price=NaN/300000&enterprise=0&qsVersion=1.0&sort=d_dt_crea&m=search_hp_last",n,,
5830312,result,89,214139287,385198,https://www.seloger.com/professionnels/agences-immobilieres/hendaye-64700/agence-10941/,LOIa IMMObILIER,,05 59 08 71 23,t,,Hendaye,71.99792960662526,0,1,,,,f,t,,Centre Ville-La plage,D,appartement,,1,E,,1,,f,f,f,1553,1,64700,8,278200,3864,,982997,3,"appartement à vendre - Venez decouvrir ce bel appartement de grande surface, situe à proximite du centre-ville. Il est equipe d'une cuisine separee, d'un salon, de deux grandes chambres, d'une salle d'eau et d'un WC separe. Il est situe au 2eme et dernier etage et offre une vue imprenable sur la mer, la baie et Fontarrabie. Cet appartement [...]",2,"3 pieces, 2 chambres, 72 m2, etage 2/2, 2 balcon, parking",https://www.seloger.com/annonces/achat/appartement/hendaye-64/214139287.htm,,2024-06-29 14:07:32.721473,"https://www.seloger.com/list.htm?projects=2,5&types=1&natures=1,2,4&places=[{%22inseeCodes%22:[640260]}]&price=NaN/300000&enterprise=0&qsVersion=1.0&sort=d_dt_crea&m=search_hp_last",n,,
5849240,result,92,214800415,231216,https://www.seloger.com/professionnels/agences-immobilieres/hendaye-64700/agence-29439/,EKI IMMOBILIER,https://v.seloger.com/s/width/150/logos/0/i/v/5/0iv520kpgcr4nn5tm50r0k1ydo1k96cfr79q5ci68.jpg,05 59 20 33 00,t,http://www.eki-immobilier.com/,Hendaye,71.99792960662526,0,1,,,,f,t,,Centre Ville-La plage,D,appartement,,1,E,,1,,f,f,f,1553,1,64700,5,278200,3864,,30231216,3,"appartement à vendre - Au 2ème et dernier etage de résidence sans ascenseur, spacieux 3 pieces de 72m2.proche du centre ville. Séjour avec belle vue sur Baie, cuisine séparée, deux chambres avec balcon avec vue montagnes, salle d'eau. Son plus un parking extérieur et une cave",2,"3 pieces, 2 chambres, 72 m2, etage 2/0, parking",https://www.seloger.com/annonces/achat/appartement/hendaye-64/214800415.htm,,2024-07-16 09:46:28.380868,"https://www.seloger.com/list.htm?projects=2,5&types=1&natures=1,2,4&places=[{%22inseeCodes%22:[640260]}]&price=NaN/300000&enterprise=0&qsVersion=1.0&sort=d_dt_crea&m=search_hp_last",y,1 month,
4675522,result,68,211512245,449870,https://www.seloger.com/professionnels/agences-immobilieres/hendaye-64700/agence-7707/,aGENCE HENDaYE IMMObILIER,,05 59 20 66 66,t,,Hendaye,66.4760543245175,0,1,,,,f,t,,Centre Ville-La plage,D,appartement,,1,B,,1,,f,f,f,1557,1,64700,10,279000,4197,,30449870,4,"appartement à vendre - Decouvrez votre prochaine maison à Hendaye ! Ce charmant appartement de 66 m2, situe dans le quartier residentiel calme d'Irandatz, vous offre tout ce dont vous avez besoin pour une vie confortable et pratique. avec 3 grandes chambres, 1 salle de bain moderne et une terrasse parfaite pour profiter du plein air, cet [...]",2,"4 pieces, 3 chambres, 66 m2, etage 0/0, jardin, ascenseur",https://www.seloger.com/annonces/achat/appartement/hendaye-64/211512245.htm,https://player.previsite.net/video/1a7Ca998C7bE336b831EF3F959D2DabC,2024-06-29 14:07:09.969664,"https://www.seloger.com/list.htm?projects=2,5&types=1&natures=1,2,4&places=[{%22inseeCodes%22:[640260]}]&price=NaN/300000&enterprise=0&qsVersion=1.0&sort=d_dt_crea&m=search_hp_last",n,,
2484048,result,108,193558407,60975,https://www.seloger.com/professionnels/agences-immobilieres/ciboure-64500/agence-18435/,agence de la Nivelle,https://v.seloger.com/s/width/150/logos/1/k/t/p/1ktpbg4dg64tu5y66hhjc152e63awlwgquiwzdux4.jpg,05 59 23 81 73,t,http://www.orpi.com/agnivelle,Hendaye,30.0003225459628,0,1,,,f,f,t,,Centre Ville-La plage,F,studio,,1,B,,1,,f,f,f,1558,1,64700,7,279033,9301,,30060975,1,"appartement à vendre - HENDaYE pLaGE - appartement type t1 bis à 2 pas de la grande plage, comprenant , chambre avec placard, salle d'eau, sejour cuisine donnant sur terrasse exposee au sud ouest, ideal pour les vacances au bord de la mer Ref. annonce : 067045E2bHUD",2,"1 piece, 30 m2, etage 2/4, terrasse, ascenseur",https://www.seloger.com/annonces/achat/appartement/hendaye-64/193558407.htm,,2024-06-29 14:07:56.09408,"https://www.seloger.com/list.htm?projects=2,5&types=1&natures=1,2,4&places=[{%22inseeCodes%22:[640260]}]&price=NaN/300000&enterprise=0&qsVersion=1.0&sort=d_dt_crea&m=search_hp_last",y,1 month,
3934767,result,78,208335747,231216,https://www.seloger.com/professionnels/agences-immobilieres/hendaye-64700/agence-29439/,EKI IMMObILIER,https://v.seloger.com/s/width/150/logos/0/i/v/5/0iv520kpgcr4nn5tm50r0k1ydo1k96cfr79q5ci68.jpg,05 59 20 33 00,t,http://www.eki-immobilier.com/,Hendaye,25,0,1,,,,f,t,,Centre Ville-La plage,E,studio,,1,C,,1,,f,f,f,1563,1,64700,6,280000,11200,,30231216,1,"appartement à vendre - En front de mer, vous trouverez au 2eme et dernier etage , un studio en duplex avec mezzanine entierement renove avec goût. Depuis sa terrasse magnifique vue mer . Son plus place de parking privative.",2,"1 piece, 25 m2, etage 0/0, terrasse, parking",https://www.seloger.com/annonces/achat/appartement/hendaye-64/208335747.htm,,2024-06-29 14:07:27.296806,"https://www.seloger.com/list.htm?projects=2,5&types=1&natures=1,2,4&places=[{%22inseeCodes%22:[640260]}]&price=NaN/300000&enterprise=0&qsVersion=1.0&sort=d_dt_crea&m=search_hp_last",n,,
3945348,result,23,206610051,75897,https://www.seloger.com/professionnels/agences-immobilieres/hendaye-64700/agence-129963/,batIMO aGENCE LaGUILLON,https://v.seloger.com/s/width/150/logos/1/b/c/t/1bctbb3tho67n51exo9090awsfvhoxg1o3t5gtr40.jpg,05 59 48 00 78,t,http://www.agence-laguillon.com/,Hendaye,71.53806847215125,0,1,,,,f,t,,Centre Ville-La plage,E,appartement,,1,C,,1,,f,f,f,1563,1,64700,14,280000,3914,,30075897,4,"appartement à vendre - au calme dans une residence situee au coeur du centre ville d'Hendaye, pres de la mairie, appartement de type 4 pieces comprenant une entree, sejour-salle à manger ouvrant sur une terrasse exposee Ouest, cuisine separee, 3 chambres dont deux avec placards et terrasse (ouest et sud), salle de bains, wc independants, une [...]",2,"4 pieces, 3 chambres, 72 m2, etage 0/1, terrasse",https://www.seloger.com/annonces/achat/appartement/hendaye-64/206610051.htm,,2024-06-29 14:06:19.052135,"https://www.seloger.com/list.htm?projects=2,5&types=1&natures=1,2,4&places=[{%22inseeCodes%22:[640260]}]&price=NaN/300000&enterprise=0&qsVersion=1.0&sort=d_dt_crea&m=search_hp_last",y,1 month,
5061787,result,84,214065915,75897,https://www.seloger.com/professionnels/agences-immobilieres/hendaye-64700/agence-129963/,batIMO aGENCE LaGUILLON,https://v.seloger.com/s/width/150/logos/1/b/c/t/1bctbb3tho67n51exo9090awsfvhoxg1o3t5gtr40.jpg,05 59 48 00 78,t,http://www.agence-laguillon.com/,Hendaye,47.93084845512506,0,1,,,,f,t,,Gare-Joncaux,C,appartement,,1,A,,1,,f,f,f,1636,1,64700,11,282700,6117,,30075897,3,"appartement à vendre - au calme dans une belle et petite copropriete entierement renovee cette annee, proche de la baie cote belcenia et du centre ville, au deuxieme et dernier etage, beau 3 pieces comprenant un lumineux sejour-cuisine, deux chambres avec placards, salle de bains, wc. Une cave ainsi que deux places de parking dont une couverte [...]",2,"3 pieces, 2 chambres, 48 m2, etage 2/2, parking",https://www.seloger.com/annonces/achat/appartement/hendaye-64/214065915.htm,,2024-06-29 14:07:30.416748,"https://www.seloger.com/list.htm?projects=2,5&types=1&natures=1,2,4&places=[{%22inseeCodes%22:[640260]}]&price=NaN/300000&enterprise=0&qsVersion=1.0&sort=d_dt_crea&m=search_hp_last",n,,293193
5849326,result,7,213636125,75897,https://www.seloger.com/professionnels/agences-immobilieres/hendaye-64700/agence-129963/,BATIMO AGENCE LAGUILLON,https://v.seloger.com/s/width/150/logos/1/b/c/t/1bctbb3tho67n51exo9090awsfvhoxg1o3t5gtr40.jpg,05 59 48 28 00,t,http://www.agence-laguillon.com/,Hendaye,56.99596774193548,0,1,,,,f,t,,Gare-Joncaux,C,appartement,,1,A,,1,,f,f,f,1578,1,64700,14,282700,4960,,30075897,3,"appartement à vendre - Au calme dans une petite copropriété rénovée entièrement cette année, à proximité immédiate belcenia et de la baie, appartement de type 3 pieces au rdc comprenant une entrée, séjour-cuisine sur balcon, deux chambres avec placard, salle de bains, wc. Une cave ainsi que deux places de parkings complètent ce bien. Rare dans le [...]",2,"3 pieces, 2 chambres, 57 m2, etage 0/2, balcon, terrasse, parking",https://www.seloger.com/annonces/achat/appartement/hendaye-64/Gare-Joncaux/213636125.htm,,2024-07-16 09:45:10.96529,"https://www.seloger.com/list.htm?projects=2,5&types=1&natures=1,2,4&places=[{%22inseeCodes%22:[640260]}]&price=NaN/300000&enterprise=0&qsVersion=1.0&sort=d_dt_crea&m=search_hp_last",n,,
3523072,result,62,206629829,492750,https://www.seloger.com/professionnels/agences-immobilieres/peyrehorade-40300/agence-227647/,aIC CabINEt DE pEYREHORaDE,https://v.seloger.com/s/width/150/logos/0/d/5/u/0d5urq7hhn6o5vyc90gp5zco1hcxx23l9w70muk38.jpg,05 58 70 90 22,t,https://peyrehorade.arthurimmo.com/,Hendaye,71.53671461014383,0,1,,,f,f,t,,Moleres-Sopite,D,appartement,,1,D,,1,,f,f,f,1582,1,64700,7,224200,3963,,30492750,4,appartement à vendre - appartement t4 HENDaYE Habiter en bord de mer dans un environnement paisible vous a toujours fait rêver? Realisez ce projet grâce à ce charmant appartement de 84 m2 avec balcon et cave. bonus : le fronton privatif à la residence vous permettra de vous defouler entre amis ! Contactez nous et allons visiter votre futur nid [...],2,"4 pieces, 3 chambres, 72 m2, etage 0/–, 3 balcon",https://www.seloger.com/annonces/achat/appartement/hendaye-64/moleres-sopite/206629829.htm,,2024-06-29 14:07:06.976051,"https://www.seloger.com/list.htm?projects=2,5&types=1&natures=1,2,4&places=[{%22inseeCodes%22:[640260]}]&price=NaN/300000&enterprise=0&qsVersion=1.0&sort=d_dt_crea&m=search_hp_last",y,2 months,283500
4995218,result,92,213317435,449870,https://www.seloger.com/professionnels/agences-immobilieres/hendaye-64700/agence-7707/,aGENCE HENDaYE IMMObILIER,,05 59 20 66 66,t,,Hendaye,55.00096543734312,0,1,,,,f,t,,Centre Ville-La plage,E,appartement,,1,F,,1,,f,f,f,1590,1,64700,8,284850,5179,,30449870,3,"appartement à vendre - bienvenue dans votre nouveau bien dans la belle region d'Hendaye ! Ce charmant appartement de style classique dispose d'un jardin exterieur parfait pour profiter du plein air et se detendre apres une longue journee. La zone nuit dispose de deux chambres, ce qui la rend ideale pour les couples ou les petites familles. La [...]",2,"3 pieces, 2 chambres, 55 m2, etage 0/0, terrasse, jardin",https://www.seloger.com/annonces/achat/appartement/hendaye-64/213317435.htm,https://tour.previsite.com/C4aD08ED-6bb1-FC45-910b-3998C5949323,2024-06-29 14:07:33.94922,"https://www.seloger.com/list.htm?projects=2,5&types=1&natures=1,2,4&places=[{%22inseeCodes%22:[640260]}]&price=NaN/300000&enterprise=0&qsVersion=1.0&sort=d_dt_crea&m=search_hp_last",n,,
5830263,result,17,222273337,531006,https://www.seloger.com/professionnels/agences-immobilieres/hendaye-64700/agence-131251/,O.G.I. - a. pEREZ IMMObILIER,,06 62 82 86 81,t,,Hendaye,55.00096543734312,0,1,,,,f,t,,Centre Ville-La plage,E,appartement,,1,F,,1,,f,f,f,1590,1,64700,8,284850,5179,,30531006,3,"appartement à vendre - Venez vous installer dans votre nouvel espace dans la magnifique region d'Hendaye! Ce magnifique appartement de style traditionnel possede un jardin exterieur ideal pour profiter de la nature et se relaxer apres une journee remplie. Deux chambres sont disponibles dans la zone nuit, ce qui en fait une option parfaite pour [...]",2,"3 pieces, 2 chambres, 55 m2, etage 0/–, terrasse, jardin",https://www.seloger.com/annonces/achat/appartement/hendaye-64/centre-ville-la-plage/222273337.htm,,2024-06-29 14:06:16.271777,"https://www.seloger.com/list.htm?projects=2,5&types=1&natures=1,2,4&places=[{%22inseeCodes%22:[640260]}]&price=NaN/300000&enterprise=0&qsVersion=1.0&sort=d_dt_crea&m=search_hp_last",n,,
