id,object,task_id,annonce_id,agency_id,agency_page,agency_contact_name,agency_img_url,agency_phone_number,agency_has_email,agency_link,address,area,bedrooms_count,business_unit,coownership_annual_charges,coownership_number_of_lots,coownership_is_syndic_procedure,contact_is_private_seller,contact_email,description,district,dpe,estate_type,electricity_consumption,estate_type_id,ges,gas_emissions,highlighting_level,insee_code,is_furnished,is_exclusive,is_expired,monthly_price,nature,postal_code,picture_count,price,price_per_meter,price_decrease_percent,publication_id,rooms,short_description,transaction_type,tags,url,virtual_visit_url,collected_at,input_url,sold,selling_time,old_price
4121836,result,77,206922031,385198,https://www.seloger.com/professionnels/agences-immobilieres/hendaye-64700/agence-10941/,LOIa IMMObILIER,,05 59 08 71 23,t,,Hendaye,70.0034758428919,0,1,,,,f,t,,Centre Ville-La Plage,G,appartement,,1,G,,1,,f,f,f,1128,1,64700,11,201400,2877,,982997,4,"appartement à vendre - Nous vous presentons ce beau t3 de 68m2 situe à proximite du centre ville (Quartier Irandatz), proche de toutes les commodites telles que supermarche, ecole primaire, gare et pharmacie. L'appartement est un troisieme et dernier etage mitoyen seulement par le bas, avec vues sur La Rhune d'un cote et sur la baie de txinguidi [...]",2,"4 pieces, 2 chambres, 70 m2, etage 3/3",https://www.seloger.com/annonces/achat/appartement/hendaye-64/206922031.htm,,2024-06-29 14:07:26.818065,"https://www.seloger.com/list.htm?projects=2,5&types=1&natures=1,2,4&places=[{%22inseeCodes%22:[640260]}]&price=NaN/300000&enterprise=0&qsVersion=1.0&sort=d_dt_crea&m=search_hp_last",n,,
5830306,result,75,214800411,231216,https://www.seloger.com/professionnels/agences-immobilieres/hendaye-64700/agence-29439/,EKI IMMObILIER,https://v.seloger.com/s/width/150/logos/0/i/v/5/0iv520kpgcr4nn5tm50r0k1ydo1k96cfr79q5ci68.jpg,05 59 20 33 00,t,http://www.eki-immobilier.com/,Hendaye,67.99459824442944,0,1,,,,f,t,,Orio,G,appartement,,1,G,,1,,f,f,f,1128,1,64700,7,201400,2962,,30231216,3,"appartement à vendre - au 3eme et dernier etage de maison sans ascenseur , appartement avec vue degagee sur montagnes et mer, exposition est/Ouest. Sejour, cuisine separee, 2 chambres, bureau, salle d'eau.",2,"3 pieces, 2 chambres, 68 m2, etage 3/3",https://www.seloger.com/annonces/achat/appartement/hendaye-64/214800411.htm,,2024-06-29 14:07:13.253916,"https://www.seloger.com/list.htm?projects=2,5&types=1&natures=1,2,4&places=[{%22inseeCodes%22:[640260]}]&price=NaN/300000&enterprise=0&qsVersion=1.0&sort=d_dt_crea&m=search_hp_last",n,,
5194990,result,87,215871777,465386,https://www.seloger.com/professionnels/agences-immobilieres/hendaye-64700/agence-97287/,GUY HOQUET HENDAYE,https://v.seloger.com/s/width/150/logos/0/e/3/q/0e3q8x48ny3apy7og2cn1zlldo8tx3lwvhv62nibc.jpg,05 59 59 98 77,t,,Hendaye,46.99679046309033,1,1,720,15,f,f,t,"Au dernier etage, Bel appartement très ensoleillé, refait. Le bien s'accompagne d'un balcon où nous pouvons profiter d'une belle vue magnifique sur la baie du Txingudi tout en prenant son repas et se relaxant. De plus, Ii vous offre une place de parking et une cave. Il est à 1,2km de la plage.  Copropriété de 15 lots (Pas de procédure en cours).  Charges annuelles : 720.00 euros. Marie POUSTIS (EI) Agent Commercial - Numéro RSAC : - .",Moleres-Sopite,D,appartement,161,1,D,31,1,,f,t,f,1148,1,64700,9,205000,4362,4362,30465386,2,"appartement à vendre - Au dernier etage, Bel appartement très ensoleillé, refait. Le bien s'accompagne d'un balcon où nous pouvons profiter d'une belle vue magnifique sur la baie du Txingudi tout en prenant son repas et se relaxant. De plus, Ii vous offre une place de parking et une cave. Il est à 1,2km de la plage.  Copropriété de 15 lots (Pas [...]",2,"2 pieces, 1 chambre, 47 m², etage 3/3, balcon",https://www.seloger.com/annonces/achat/appartement/hendaye-64/moleres-sopite/215871777.htm,,2024-07-16 09:46:25.753385,"https://www.seloger.com/list.htm?projects=2,5&types=1&natures=1,2,4&places=[{%22inseeCodes%22:[640260]}]&price=NaN/300000&enterprise=0&qsVersion=1.0&sort=d_dt_crea&m=search_hp_last",y,1 month,
5830304,result,70,217635775,449870,https://www.seloger.com/professionnels/agences-immobilieres/hendaye-64700/agence-7707/,aGENCE HENDaYE IMMObILIER,,05 59 20 66 66,t,,Hendaye,47.00089525514772,0,1,,,,f,t,,Centre Ville-La Plage,C,appartement,,1,A,,1,,f,f,f,1175,1,64700,12,210000,4468,,30449870,2,"appartement à vendre - au centre ville, dans residence senior de 2018, grand t2 de 47,75m2 situe au 3eme et dernier etage avec ascenseur d'une residence securisee. Il se compose d'une entree avec placard, cuisine ouverte sur salon et sejour avec vue sur les toits et aperçu baie, grande chambre avec velux et salle d'eau avec WC. Le tout en parfait [...]",2,"2 pieces, 1 chambre, 47 m2, etage 3/0, ascenseur",https://www.seloger.com/annonces/achat/appartement/hendaye-64/217635775.htm,,2024-06-29 14:07:10.895103,"https://www.seloger.com/list.htm?projects=2,5&types=1&natures=1,2,4&places=[{%22inseeCodes%22:[640260]}]&price=NaN/300000&enterprise=0&qsVersion=1.0&sort=d_dt_crea&m=search_hp_last",n,,
4675638,result,97,211563161,75897,https://www.seloger.com/professionnels/agences-immobilieres/hendaye-64700/agence-129963/,batIMO aGENCE LaGUILLON,https://v.seloger.com/s/width/150/logos/1/b/c/t/1bctbb3tho67n51exo9090awsfvhoxg1o3t5gtr40.jpg,05 59 48 28 00,t,http://www.agence-laguillon.com/,Hendaye,33.59837854692859,0,1,,,,f,t,,Moleres-Sopite,C,appartement,,1,C,,1,,f,t,f,1206,1,64700,1,215500,6414,,30075897,2,"appartement à vendre - bel appartement 2 pieces en parfait etat situe dans un environnement calme et situation dominante avec de magnifiques vues, comprenant une entree avec placard, sejour-cuisine equipee ouvrant sur une belle terrasse exposee Ouest de 10m2, une chambre avec placard ouvrant elle aussi sur la terrasse, salle de bains-wc. Une place [...]",2,"2 pieces, 1 chambre, 34 m2, etage 1/2, terrasse, parking, ascenseur",https://www.seloger.com/annonces/achat/appartement/hendaye-64/211563161.htm,,2024-06-29 14:07:36.565365,"https://www.seloger.com/list.htm?projects=2,5&types=1&natures=1,2,4&places=[{%22inseeCodes%22:[640260]}]&price=NaN/300000&enterprise=0&qsVersion=1.0&sort=d_dt_crea&m=search_hp_last",y,1 month,
5830288,result,48,217372625,359812,https://www.seloger.com/professionnels/agents-commerciaux/ascain-64310/agence-34599/,agent Commercial 3G IMMO bOISNON alexandra,https://v.seloger.com/s/width/150/logos/1/r/0/q/1r0qlrwab56anbiv7cw5chx1gcpcv0zflpkfwdqa6.jpg,06 63 69 71 31,t,https://www.3gimmobilier.com/boisnon,Hendaye,40,0,1,,,,f,t,,Centre Ville-La Plage,C,appartement,,1,A,,1,,f,f,f,1222,1,64700,9,218400,5460,,30359812,2,"appartement à vendre - 64700 HENDaYE alexandra boisnon vous propose, dans une residence paisible et bien entretenue, cet appartement au deuxieme etage avec ascenseur.  avec ses 40m2 de surface, il se compose d'une entree avec placard, d'un sejour lumineux donnant acces à une terrasse, d'une cuisine ouverte, d'une chambre avec balcon et d'une [...]",2,"2 pieces, 1 chambre, 40 m2, etage –/0, terrasse",https://www.seloger.com/annonces/achat/appartement/hendaye-64/217372625.htm,,2024-06-29 14:06:45.607242,"https://www.seloger.com/list.htm?projects=2,5&types=1&natures=1,2,4&places=[{%22inseeCodes%22:[640260]}]&price=NaN/300000&enterprise=0&qsVersion=1.0&sort=d_dt_crea&m=search_hp_last",n,,
5904772,result,3,224180285,476929,https://www.seloger.com/professionnels/agences-immobilieres/hendaye-64700/agence-129167/,SQUARE HABITAT HENDAYE,,05 59 51 05 10,t,,Hendaye,79.79688066739209,0,1,,,,f,t,,Moleres-Sopite,F,appartement,,1,F,,1,,f,f,f,1231,1,64700,6,220000,2757,,30476929,4,"appartement à vendre - appartement de type T4 au 4ème etage avec ascenseur . Situé à proximité des commodités vous permettant de profiter d'un mode de vie tout à pied. Il se compose d'une grande piece à vivre avec coin cuisine, trois chambres, une salle d'eau et une cave viennent compléter ce bien. A découvrir rapidement !",2,"4 pieces, 3 chambres, 80 m2, etage 3/0, balcon, ascenseur",https://www.seloger.com/annonces/achat/appartement/hendaye-64/moleres-sopite/224180285.htm,,2024-07-16 09:45:09.292366,"https://www.seloger.com/list.htm?projects=2,5&types=1&natures=1,2,4&places=[{%22inseeCodes%22:[640260]}]&price=NaN/300000&enterprise=0&qsVersion=1.0&sort=d_dt_crea&m=search_hp_last",n,,
5830300,result,65,218345621,75897,https://www.seloger.com/professionnels/agences-immobilieres/hendaye-64700/agence-129963/,batIMO aGENCE LaGUILLON,https://v.seloger.com/s/width/150/logos/1/b/c/t/1bctbb3tho67n51exo9090awsfvhoxg1o3t5gtr40.jpg,05 59 48 28 00,t,http://www.agence-laguillon.com/,Hendaye,38.58913916535708,0,1,,,,f,t,,Moleres-Sopite,C,appartement,,1,A,,1,,f,t,f,1236,1,64700,1,221000,5727,,30075897,2,"appartement à vendre - agreable 2 pieces idealement situe à 1km de la plage dans une residence de standing (piscine et aire de jeux) : entree, sejour-cuisine equipee ouvrant sur une loggia equipee de panneaux en verre coulissants, une chambre avec placards, sde-wc. Une cave ainsi qu'une place de parking en sous-sol completent ce bien.",2,"2 pieces, 1 chambre, 39 m2, etage 1/2, terrasse, parking, ascenseur, piscine",https://www.seloger.com/annonces/achat/appartement/hendaye-64/218345621.htm,,2024-06-29 14:07:08.566537,"https://www.seloger.com/list.htm?projects=2,5&types=1&natures=1,2,4&places=[{%22inseeCodes%22:[640260]}]&price=NaN/300000&enterprise=0&qsVersion=1.0&sort=d_dt_crea&m=search_hp_last",y,1 month,
5830267,result,38,222064089,449870,https://www.seloger.com/professionnels/agences-immobilieres/hendaye-64700/agence-7707/,AGENCE HENDAYE IMMOBILIER,,05 59 20 66 66,t,,Hendaye,40,0,1,,,,f,t,,Centre Ville-La Plage,C,appartement,,1,A,,1,,f,f,f,1245,1,64700,7,222600,5565,,30449870,2,appartement à vendre - Changer de logement pour un appartement de grande dimension pour un T2 s'accompagnant d'une belle terrasse à vivre bien exposée sur le territoire de Hendaye. Bâtiment conforme aux normes d'accessibilité. Cet appartement est au premier niveau d'un bâtiment sur 4 etages ,2,"2 pieces, 1 chambre, 40 m2, etage 1/4, terrasse, parking, ascenseur",https://www.seloger.com/annonces/achat/appartement/hendaye-64/222064089.htm,https://player.previsite.net/video/510D491E56D64F1F77AEDA48030B9A3C,2024-06-29 14:06:19.498533,"https://www.seloger.com/list.htm?projects=2,5&types=1&natures=1,2,4&places=[{%22inseeCodes%22:[640260]}]&price=NaN/300000&enterprise=0&qsVersion=1.0&sort=d_dt_crea&m=search_hp_last",n,,
5928269,result,49195394,224578491,531006,https://www.seloger.com/professionnels/agences-immobilieres/hendaye-64700/agence-131251/,O.G.I. - A. PEREZ IMMOBILIER,,06 62 82 86 81,t,,Hendaye,40,0,1,,,,f,t,,Centre Ville-La Plage,C,appartement,,1,A,,1,,f,f,f,1245,1,64700,7,222600,5565,,30531006,2,"appartement à vendre - Hendaye,proche de toutes commodites venez decouvrir ce T2 de plus de 40m2 avec une magnifique terrasse à vivre bien exposée. Construit en respectant les normes d'accessibilité. Cet appartement se trouve au premier etage d'un immeuble de 4 etages il est équipé d'un ascenseur. Construit en 2010. Ce logement se compose [...]",2,"2 pieces, 1 chambre, 40 m2, etage 1/4, parking, ascenseur",https://www.seloger.com/annonces/achat/appartement/hendaye-64/centre-ville-la-plage/224578491.htm,,2024-07-23 10:22:46.895593,"https://www.seloger.com/list.htm?projects=2,5&types=1&natures=1,2,4&places=[{%22inseeCodes%22:[640260]}]&price=NaN/300000&enterprise=0&qsVersion=1.0&sort=d_dt_crea&m=search_hp_last",n,,
5513487,result,74,217343121,522870,https://www.seloger.com/professionnels/agences-immobilieres/biarritz-64200/agence-353500/,ajp MatEILLE bIaRRItZ,https://v.seloger.com/s/width/150/logos/1/p/z/m/1pzmur3zdv5fmunqgkufr5ub58gr13aeqwpq1a2ig.jpg,05 59 24 17 12,t,,Hendaye,38.0027266530334,0,1,,,,f,t,,Moleres-Sopite,C,appartement,,1,A,,1,,f,f,f,1247,1,64700,4,223000,5868,,30522870,2,"appartement à vendre - Hendaye, dans une jolie copropriete à proximite immediate des plages, charmant t2 de 38 m2 fonctionnel et moderne. Il beneficie d'une grande terrasse et un jardin en jouissance exclusive. possibilite box. (4.69 % d'honoraires ttC à la charge de l'acquereur.) Copropriete de 90 lots (procedure en cours).  Charges annuelles [...]",2,"2 pieces, 1 chambre, 38 m2, etage –/3, terrasse, jardin, box",https://www.seloger.com/annonces/achat/appartement/hendaye-64/moleres-sopite/217343121.htm,,2024-06-29 14:07:12.826731,"https://www.seloger.com/list.htm?projects=2,5&types=1&natures=1,2,4&places=[{%22inseeCodes%22:[640260]}]&price=NaN/300000&enterprise=0&qsVersion=1.0&sort=d_dt_crea&m=search_hp_last",n,,
5849236,result,22,223435265,68196,https://www.seloger.com/professionnels/agences-immobilieres/anglet-64600/agence-102866/,CABINET DE LESSEPS,https://v.seloger.com/s/width/150/logos/1/w/7/6/1w76g0bmqm3rs9syk8d3l38q0hdj8dw71y0fakizk.jpg,05 59 50 07 79,t,http://www.cabinet-de-lesseps.com/,Hendaye,30.99805393383375,0,1,,,,f,t,,Gare-Joncaux,C,appartement,,1,A,,2,,f,f,f,1247,1,64700,6,223000,7194,,30068196,2,"appartement de luxe à vendre - HENDAYE - Venez découvrir 'DOMINGO', ce charmant appartement de type 2 de 31m2 environ situé au rez de jardin d'une petite résidence. Ce bien est en parfait état et permet de poser ses affaires sans travaux. Très lumineux, il profite de l'ensoleillement depuis le salon/cuisine et la chambre. Vous profiterez de sa [...]",8,"2 pieces, 1 chambre, 31 m2, etage 0/2, terrasse, jardin",https://www.seloger.com/annonces/achat-de-prestige/appartement/hendaye-64/Gare-Joncaux/223435265.htm,,2024-07-16 09:45:18.063302,"https://www.seloger.com/list.htm?projects=2,5&types=1&natures=1,2,4&places=[{%22inseeCodes%22:[640260]}]&price=NaN/300000&enterprise=0&qsVersion=1.0&sort=d_dt_crea&m=search_hp_last",n,,
5830292,result,53,220012687,465386,https://www.seloger.com/professionnels/agences-immobilieres/hendaye-64700/agence-97287/,GUY HOQUEt HENDaYE,https://v.seloger.com/s/width/150/logos/0/e/3/q/0e3q8x48ny3apy7og2cn1zlldo8tx3lwvhv62nibc.jpg,05 59 59 98 77,t,,Hendaye,40,0,1,,,,f,t,,Orio,C,appartement,,1,A,,1,,f,f,f,1308,1,64700,8,223400,5850,,30465386,2,"appartement à vendre - Dans une residence securisee recente, venez decouvrir un jolie appartement de 2 pieces refait à neuf. Il se compose d'une entree avec placard, un sejour avec cuisine ouverte donnant sur une belle terrasse, une chambre avec placard et une salle d'eau avec toilettes. Cote stationnement, vous beneficierez d'une place privative [...]",2,"2 pieces, 1 chambre, 40 m2, etage 2/6, balcon, ascenseur",https://www.seloger.com/annonces/achat/appartement/hendaye-64/orio/220012687.htm,,2024-06-29 14:07:02.71874,"https://www.seloger.com/list.htm?projects=2,5&types=1&natures=1,2,4&places=[{%22inseeCodes%22:[640260]}]&price=NaN/300000&enterprise=0&qsVersion=1.0&sort=d_dt_crea&m=search_hp_last",n,,234000
3506298,result,102,206077807,465386,https://www.seloger.com/professionnels/agences-immobilieres/hendaye-64700/agence-97287/,GUY HOQUEt HENDaYE,https://v.seloger.com/s/width/150/logos/0/e/3/q/0e3q8x48ny3apy7og2cn1zlldo8tx3lwvhv62nibc.jpg,05 59 59 98 77,t,,Hendaye,48.998257839721255,1,1,360,6,f,f,t,"Idealement situe entre les plages et la frontiere espagnole, agreable t2 bis de 50 m2 environ avec vue sur les pyrenees compose d'un sejour avec cuisine amenagee et equipee de 28m2, un coin nuit, une chambre et une salle d'eau avec wc. L'appartement est vendu meuble! Une cave de 4m2 complete le bien. Visite virtuelle immersive 3D disponible sur notre site internet ou en copier coller de ce lien : ?m=2oHbCQtQWo3 Copropriete de 6 lots (pas de procedure en cours).  Charges annuelles : 360.00 euros.",Orio,E,appartement,326,1,B,10,1,,t,f,f,1258,1,64700,6,225000,4592,4592,30465386,3,"appartement à vendre - Idealement situe entre les plages et la frontiere espagnole, agreable t2 bis de 50 m2 environ avec vue sur les pyrenees compose d'un sejour avec cuisine amenagee et equipee de 28m2, un coin nuit, une chambre et une salle d'eau avec wc. L'appartement est vendu meuble! Une cave de 4m2 complete le bien. Visite virtuelle [...]",2,"3 pieces, 1 chambre, 49 m2, etage 1/2",https://www.seloger.com/annonces/achat/appartement/hendaye-64/orio/206077807.htm,https://my.matterport.com/show/?m=2oHbCQtQWo3,2024-06-29 14:07:53.304239,"https://www.seloger.com/list.htm?projects=2,5&types=1&natures=1,2,4&places=[{%22inseeCodes%22:[640260]}]&price=NaN/300000&enterprise=0&qsVersion=1.0&sort=d_dt_crea&m=search_hp_last",n,,
5830261,result,15,222414369,75897,https://www.seloger.com/professionnels/agences-immobilieres/hendaye-64700/agence-129963/,batIMO aGENCE LaGUILLON,https://v.seloger.com/s/width/150/logos/1/b/c/t/1bctbb3tho67n51exo9090awsfvhoxg1o3t5gtr40.jpg,05 59 48 00 78,t,http://www.agence-laguillon.com/,Hendaye,42.001120029867465,0,1,,,,f,t,,Gare-Joncaux,E,appartement,,1,B,,1,,f,t,f,1258,1,64700,11,195000,5357,,30075897,2,"appartement à vendre - proche gare, frontiere et commerces,dans residence de 2004 (ravalement vote à la charge du vendeur), agreable 2 pieces comprenant entree, WC separe, cuisine ouverte equipee, sejour donnant sur terrasse de 7 m2 (pouvant être fermee en veranda), chambre avec grands placards et SDb. box ferme.",2,"2 pieces, 1 chambre, 42 m2, etage 2/3, terrasse, box, ascenseur",https://www.seloger.com/annonces/achat/appartement/hendaye-64/222414369.htm,,2024-06-29 14:06:15.396705,"https://www.seloger.com/list.htm?projects=2,5&types=1&natures=1,2,4&places=[{%22inseeCodes%22:[640260]}]&price=NaN/300000&enterprise=0&qsVersion=1.0&sort=d_dt_crea&m=search_hp_last",n,,225000
5767172,result,40,221364757,359178,https://www.seloger.com/professionnels/agences-immobilieres/hendaye-64700/agence-64378/,IpaRRaLDE IMMObILIER,https://v.seloger.com/s/width/150/logos/0/6/s/u/06suslue294ym3v3tm677wsf77ft8cngd4ewu6pab.jpg,05 47 75 94 67,t,,Hendaye,57.9933282011804,0,1,,,,f,t,,Centre Ville-La Plage,D,appartement,,1,A,,2,,f,t,f,1264,1,64700,25,226000,3897,,30359178,3,"appartement à vendre - Des que vous franchissez le seuil de cette charmante residence, vous êtes accueilli par une atmosphere chaleureuse et lumineuse. Ce ravissant t3, d'une superficie de 57,26 metres carres, offre un agencement astucieux qui maximise l'espace disponible. Vous decouvrirez un salon confortable, parfait pour se detendre en [...]",2,"3 pieces, 2 chambres, 58 m2, etage 2/0, balcon",https://www.seloger.com/annonces/achat/appartement/hendaye-64/221364757.htm,https://my.matterport.com/show/?m=o17CWpGimHx,2024-06-29 14:06:41.917031,"https://www.seloger.com/list.htm?projects=2,5&types=1&natures=1,2,4&places=[{%22inseeCodes%22:[640260]}]&price=NaN/300000&enterprise=0&qsVersion=1.0&sort=d_dt_crea&m=search_hp_last",n,,
5830281,result,38,221642981,75897,https://www.seloger.com/professionnels/agences-immobilieres/hendaye-64700/agence-129963/,batIMO aGENCE LaGUILLON,https://v.seloger.com/s/width/150/logos/1/b/c/t/1bctbb3tho67n51exo9090awsfvhoxg1o3t5gtr40.jpg,05 59 48 28 00,t,http://www.agence-laguillon.com/,Hendaye,27.148460715559253,0,1,,,,f,t,,Centre Ville-La Plage,D,appartement,,1,D,,1,,f,t,f,1277,1,64700,1,228400,8413,,30075897,2,"appartement à vendre - Situe au deuxieme et dernier etage avec ascenseur d'une residence situee sur la baie de txingudi à 100m de la plage et de l'ensemble des commerces. Charmant et agreable deux pieces en duplex de 42,86m2 sol. tres bien distribue il est compose d'un sejour-cuisine equipee ouvrant sur une terrasse exposee Ouest, salle d'eau-wc, [...]",2,"2 pieces, 1 chambre, 27 m2, etage 2/2, terrasse, ascenseur",https://www.seloger.com/annonces/achat/appartement/hendaye-64/221642981.htm,,2024-06-29 14:06:40.565599,"https://www.seloger.com/list.htm?projects=2,5&types=1&natures=1,2,4&places=[{%22inseeCodes%22:[640260]}]&price=NaN/300000&enterprise=0&qsVersion=1.0&sort=d_dt_crea&m=search_hp_last",n,,
5830277,result,34,221726211,531006,https://www.seloger.com/professionnels/agences-immobilieres/hendaye-64700/agence-131251/,O.G.I. - a. pEREZ IMMObILIER,,05 59 20 03 12,t,,Hendaye,44.99901748870112,0,1,,,,f,t,,Centre Ville-La plage,C,appartement,,1,C,,1,,f,f,f,1280,1,64700,6,229000,5089,,30531006,2,"appartement à vendre - appartement type 2 pieces en bon etat general situe au 4eme etage sans ascenseur, une piece à vivre, une chambre separe, une cuisine independante avec petit balconnet, une salle d'eau, un W-C independant. Cave commune. accord bien groupement GpI.",2,"2 pieces, 1 chambre, 45 m2, etage 4/–, balcon",https://www.seloger.com/annonces/achat/appartement/hendaye-64/centre-ville-la-plage/221726211.htm,,2024-06-29 14:06:38.735892,"https://www.seloger.com/list.htm?projects=2,5&types=1&natures=1,2,4&places=[{%22inseeCodes%22:[640260]}]&price=NaN/300000&enterprise=0&qsVersion=1.0&sort=d_dt_crea&m=search_hp_last",n,,
5830289,result,50,220470735,385198,https://www.seloger.com/professionnels/agences-immobilieres/hendaye-64700/agence-10941/,LOIa IMMObILIER,,05 59 08 71 23,t,,Hendaye,57.960010124019234,0,1,,,,f,t,,Centre Ville-La plage,C,appartement,,1,C,,1,,f,f,f,1280,1,64700,9,229000,3951,,982997,2,"appartement à vendre - Grand appartement t2 de 56 m2, refait à neuf, proche des commodites et du centre-ville. Loggia fermee donnant sur cuisine/salon, une chambre avec dressing, grande cave attenante. aucun vis-a-vis, vue sur parc arbore et montagne. parking dans la residence.",2,"2 pieces, 1 chambre, 58 m2, etage 0/0",https://www.seloger.com/annonces/achat/appartement/hendaye-64/220470735.htm,,2024-06-29 14:06:46.590832,"https://www.seloger.com/list.htm?projects=2,5&types=1&natures=1,2,4&places=[{%22inseeCodes%22:[640260]}]&price=NaN/300000&enterprise=0&qsVersion=1.0&sort=d_dt_crea&m=search_hp_last",n,,
5830313,result,90,213620357,385198,https://www.seloger.com/professionnels/agences-immobilieres/hendaye-64700/agence-10941/,LOIa IMMObILIER,,05 59 08 71 23,t,,Hendaye,43.56925418569254,0,1,,,,f,t,,Centre Ville-La plage,C,appartement,,1,C,,1,,f,f,f,1280,1,64700,10,229000,5256,,982997,2,"appartement à vendre - En dernier etage, joli et grand t2 de 45 m2 avec vue Mer. Spacieux et lumineux, cuisine avec balcon et WC separes. a VISItER DE tOUtE URGENCE. Cave commune",2,"2 pieces, 1 chambre, 44 m2, etage 4/4",https://www.seloger.com/annonces/achat/appartement/hendaye-64/213620357.htm,,2024-06-29 14:07:33.124667,"https://www.seloger.com/list.htm?projects=2,5&types=1&natures=1,2,4&places=[{%22inseeCodes%22:[640260]}]&price=NaN/300000&enterprise=0&qsVersion=1.0&sort=d_dt_crea&m=search_hp_last",n,,
5513541,result,63,218862799,359178,https://www.seloger.com/professionnels/agences-immobilieres/hendaye-64700/agence-64378/,IpaRRaLDE IMMObILIER,https://v.seloger.com/s/width/150/logos/0/6/s/u/06suslue294ym3v3tm677wsf77ft8cngd4ewu6pab.jpg,05 47 75 94 67,t,,Hendaye,43.4906196702672,0,1,,,,f,t,,Centre Ville-La plage,E,appartement,,1,B,,1,,f,t,f,1283,1,64700,30,229500,5277,,30359178,3,"appartement à vendre - belle opportunite à saisir à Hendaye (64). Situe à quelques minutes à pied du centre-ville et de la magnifique baie de txingudi, ce charmant t3 offre un cadre de vie ideal pour les amoureux de la tranquillite et de la proximite des commodites. Dote d'une exposition sud-est-ouest, cet appartement beneficie d'une luminosite [...]",2,"3 pieces, 2 chambres, 43 m2, etage 0/1, terrasse, parking",https://www.seloger.com/annonces/achat/appartement/hendaye-64/218862799.htm,,2024-06-29 14:07:07.460339,"https://www.seloger.com/list.htm?projects=2,5&types=1&natures=1,2,4&places=[{%22inseeCodes%22:[640260]}]&price=NaN/300000&enterprise=0&qsVersion=1.0&sort=d_dt_crea&m=search_hp_last",n,,
5148724,result,88,215302407,231216,https://www.seloger.com/professionnels/agences-immobilieres/hendaye-64700/agence-29439/,EKI IMMOBILIER,https://v.seloger.com/s/width/150/logos/0/i/v/5/0iv520kpgcr4nn5tm50r0k1ydo1k96cfr79q5ci68.jpg,05 59 20 33 00,t,http://www.eki-immobilier.com/,Hendaye,60.00521784503,0,1,,,,f,t,,Orio,A,appartement,,1,A,,1,,f,f,f,1286,1,64700,6,230000,3833,,30231216,3,"appartement à vendre - Dans une résidence récente proche de la Baie de chingoudy , vous trouverez cet appartement type 3 pieces en rez de chaussée. Entrée avec cellier, wc, séjour salon donnant sur terrasse expo plein µSud, cuisine indépendante aménagée avec accès terrasse, 2 chambres avec placard dont une avec balcon, salle de bains. Son plus un [...]",2,"3 pieces, 2 chambres, 60 m2, etage 0/2, terrasse, box, ascenseur",https://www.seloger.com/annonces/achat/appartement/hendaye-64/215302407.htm,,2024-07-16 09:46:26.243335,"https://www.seloger.com/list.htm?projects=2,5&types=1&natures=1,2,4&places=[{%22inseeCodes%22:[640260]}]&price=NaN/300000&enterprise=0&qsVersion=1.0&sort=d_dt_crea&m=search_hp_last",n,,
5830259,result,13,222656887,103574,,mapetiteagence.com,,09 72 76 01 09,t,,Hendaye,44.00229577195332,0,1,,,,f,t,,Moleres-Sopite,A,appartement neuf,,1,A,,1,,f,f,f,1210,2,64700,4,230000,5227,,30103574,2,"appartement neuf à vendre - -Decouvrez rapidement ce tres bel appartement t2 d'une surface habitable de 44 m2 beneficiant de l'avantage d'être en etage, avec terrasse à Hendaye.  Il se compose d'une belle entree qui distribue l'espace nuit avec salle de bain et WC, ainsi qu'une chambre de 14 m2. Vous accedez ensuite à une piece de vie tres [...]",2,"2 pieces, 1 chambre, 44 m2, terrasse",https://www.seloger.com/annonces/achat/appartement/hendaye-64/222656887.htm,,2024-06-29 14:06:14.360719,"https://www.seloger.com/list.htm?projects=2,5&types=1&natures=1,2,4&places=[{%22inseeCodes%22:[640260]}]&price=NaN/300000&enterprise=0&qsVersion=1.0&sort=d_dt_crea&m=search_hp_last",y,1 month,
